{
  "$schema": "https://json-schema.org/draft/2020-12/schema",
  "type": "object",
  "additionalProperties": false,
  "properties": {
    "protocol": {"type": "string", "const": "execution-state.result/v1"},
    "run_id": {"type": "string", "minLength": 1},
    "based_on_revision": {"type": "integer", "minimum": 0},
    "task_id": {"type": "string", "minLength": 1},
    "status": {"type": "string", "enum": ["complete", "blocked"]},
    "summary": {"type": "string", "minLength": 1},
    "artifacts": {
      "type": "array",
      "items": {
        "type": "object",
        "additionalProperties": false,
        "properties": {
          "path": {"type": "string", "minLength": 1},
          "purpose": {"type": "string", "minLength": 1}
        },
        "required": ["path", "purpose"]
      }
    },
    "verification": {
      "type": "array",
      "items": {
        "type": "object",
        "additionalProperties": false,
        "properties": {
          "command": {"type": "string", "minLength": 1},
          "exit_code": {"type": "integer"},
          "summary": {"type": "string", "minLength": 1}
        },
        "required": ["command", "exit_code", "summary"]
      }
    },
    "blockers": {"type": "array", "items": {"type": "string"}},
    "next_action": {"type": ["string", "null"]}
  },
  "required": [
    "protocol",
    "run_id",
    "based_on_revision",
    "task_id",
    "status",
    "summary",
    "artifacts",
    "verification",
    "blockers",
    "next_action"
  ]
}

