{"protocol":"execution-state.result/v1","run_id":"t28-1bf35e1e814144d1","based_on_revision":55,"task_id":"7.4","status":"complete","summary":"Задача 7.4 реализована: scoped API keys организации создаются, перечисляются и отзываются; сохраняется только SHA-256 hash, а API-key auth проверяет актуальный membership, tenant из URL и scope permission.","artifacts":[{"path":"internal/domain/api_key.go","purpose":"Генерация opaque API keys, валидация/хеширование и hash-excluded domain model."},{"path":"internal/repository/api_key.go","purpose":"Потокобезопасное hash-indexed in-memory хранилище API keys, list и revoke."},{"path":"internal/app/api_keys.go","purpose":"POST/GET/DELETE organization API key handlers."},{"path":"internal/app/app.go","purpose":"Маршрутизация, API-key authentication, scope и tenant enforcement."}],"verification":[{"command":"gofmt -w internal/app/app.go internal/app/api_keys.go internal/domain/api_key.go internal/repository/api_key.go","exit_code":0,"summary":"Успешно."},{"command":"GOCACHE=/tmp/iam-go-cache go test ./...","exit_code":0,"summary":"Все пакеты успешно собраны и проверены."},{"command":"GOCACHE=/tmp/iam-go-cache go vet ./...","exit_code":0,"summary":"Замечаний vet нет."}],"blockers":[],"next_action":null}