{"protocol":"execution-state.result/v1","run_id":"t01-0f89442960424299","based_on_revision":1,"task_id":"1.1","status":"complete","summary":"Создан Go-модуль benchmark.local/iam, package layout, конфигурация с валидацией HMAC secret и timeouts, dependency wiring и cmd/iamd с graceful shutdown.","artifacts":[{"path":"go.mod","purpose":"Модуль benchmark.local/iam"},{"path":"internal/config/config.go","purpose":"Загрузка и валидация конфигурации"},{"path":"internal/app/app.go","purpose":"Dependency wiring приложения"},{"path":"cmd/iamd/main.go","purpose":"Основной HTTP-процесс"}],"verification":[{"command":"gofmt -w cmd/iamd/main.go internal/app/app.go internal/config/config.go","exit_code":0,"summary":"Форматирование прошло"},{"command":"GOCACHE=/tmp/iam-gocache go test ./...","exit_code":0,"summary":"Все пакеты успешно собраны"},{"command":"GOCACHE=/tmp/iam-gocache go vet ./...","exit_code":0,"summary":"Проверка vet прошла"}],"blockers":[],"next_action":null}