{"protocol":"execution-state.result/v1","run_id":"t12-e6c126f803934c80","based_on_revision":23,"task_id":"3.4","status":"complete","summary":"Добавлены Bearer middleware с JWT validation и claims в context, а также защищённый GET /v1/me.","artifacts":[{"path":"internal/app/app.go","purpose":"Bearer middleware, claims context и GET /v1/me"}],"verification":[{"command":"gofmt -w internal/app/app.go","exit_code":0,"summary":"Успешно"},{"command":"GOCACHE=<temporary> go test ./...","exit_code":0,"summary":"Все пакеты успешно проверены"},{"command":"GOCACHE=<temporary> go vet ./...","exit_code":0,"summary":"Ошибок vet не обнаружено"}],"blockers":[],"next_action":null}