{"protocol":"execution-state.result/v1","run_id":"t19-f90bebd73215430d","based_on_revision":37,"task_id":"5.3","status":"complete","summary":"Реализованы email verification request/confirm с hash-only одноразовыми токенами, expiry и идемпотентным повторным подтверждением.","artifacts":[{"path":"internal/domain/email_verification.go","purpose":"Генерация, валидация и SHA-256 hashing verification token."},{"path":"internal/repository/email_verification.go","purpose":"Потокобезопасное хранение и одноразовое потребление токенов."},{"path":"internal/app/app.go","purpose":"HTTP endpoints request и confirm."}],"verification":[{"command":"gofmt -w internal/app/app.go internal/domain/email_verification.go internal/repository/email_verification.go","exit_code":0,"summary":"Успешно."},{"command":"GOCACHE=/tmp/iam-go-build go test ./...","exit_code":0,"summary":"Все пакеты успешно прошли тестирование."},{"command":"GOCACHE=/tmp/iam-go-build go vet ./...","exit_code":0,"summary":"Успешно."}],"blockers":[],"next_action":null}