{"protocol":"execution-state.result/v1","run_id":"t31-588068866d8f428c","based_on_revision":61,"task_id":"8.3","status":"complete","summary":"Задача 8.3 завершена: добавлены request ID, secret-safe structured JSON logs, healthz/readyz и metrics; request_id включается в error envelope.","artifacts":[{"path":"internal/app/app.go","purpose":"Request ID middleware, structured JSON logging с redaction, operations endpoints и request_id в API errors"}],"verification":[{"command":"gofmt -w internal/app/app.go","exit_code":0,"summary":"Успешно"},{"command":"GOCACHE=$(mktemp -d /tmp/iam-go-cache.XXXXXX) go test ./...","exit_code":0,"summary":"Все пакеты успешно проверены"},{"command":"GOCACHE=$(mktemp -d /tmp/iam-go-cache.XXXXXX) go vet ./...","exit_code":0,"summary":"Проверка успешно завершена"}],"blockers":[],"next_action":null}