{"protocol":"execution-state.result/v1","run_id":"t02-6943b3faec8645c1","based_on_revision":3,"task_id":"1.2","status":"complete","summary":"Chunk 1.2 выполнен: добавлены доменные ID через crypto/rand, Clock abstraction с dependency injection и типизированные ошибки not found/conflict/invalid/unauthorized.","artifacts":[{"path":"internal/domain/id.go","purpose":"Доменные ID"},{"path":"internal/domain/clock.go","purpose":"Clock abstraction"},{"path":"internal/domain/errors.go","purpose":"Типизированные ошибки"},{"path":"internal/app/app.go","purpose":"Инъекция Clock"}],"verification":[{"command":"gofmt -w internal/domain/id.go internal/domain/clock.go internal/domain/errors.go internal/app/app.go","exit_code":0,"summary":"Успешно"},{"command":"GOCACHE=$(mktemp -d /tmp/iam-go-cache.XXXXXX) go test ./...","exit_code":0,"summary":"Все пакеты прошли"},{"command":"GOCACHE=$(mktemp -d /tmp/iam-go-cache.XXXXXX) go vet ./...","exit_code":0,"summary":"Проверка прошла"}],"blockers":[],"next_action":null}