{"protocol":"execution-state.result/v1","run_id":"t27-da93bce6e1f6431d","based_on_revision":53,"task_id":"7.3","status":"complete","summary":"Задача 7.3 выполнена: tenant-scoped маршруты требуют membership и permission из актуального RoleRepository; member management больше не полагается на строковую роль. Access token roles/permissions не содержит.","artifacts":[{"path":"internal/app/app.go","purpose":"Добавлен organizationMiddleware и подключён к tenant-scoped routes."},{"path":"internal/app/organizations.go","purpose":"Проверки member management используют актуальные permissions repository."}],"verification":[{"command":"gofmt -w internal/app/app.go internal/app/organizations.go","exit_code":0,"summary":"Успешно."},{"command":"GOCACHE=/private/tmp/iam-go-cache go test ./...","exit_code":0,"summary":"Все пакеты прошли."},{"command":"GOCACHE=/private/tmp/iam-go-cache go vet ./...","exit_code":0,"summary":"Замечаний нет."}],"blockers":[],"next_action":null}