{"protocol":"execution-state.result/v1","run_id":"t32-9d680c81bdcb49a0","based_on_revision":63,"task_id":"8.4","status":"complete","summary":"Завершено wiring и lifecycle cmd/iamd: timeouts, graceful shutdown и корректный ненулевой exit code при ошибках. gofmt, go test ./... и go vet ./... прошли.","artifacts":[{"path":"cmd/iamd/main.go","purpose":"Production entrypoint с wiring зависимостей, server timeouts и graceful shutdown."}],"verification":[{"command":"gofmt -w cmd/iamd/main.go","exit_code":0,"summary":"Форматирование успешно."},{"command":"go test ./...","exit_code":0,"summary":"Все пакеты успешно проверены; test files отсутствуют."},{"command":"go vet ./...","exit_code":0,"summary":"Проверка vet успешно завершена."}],"blockers":[],"next_action":null}