{"protocol":"execution-state.result/v1","run_id":"t14-37c568bbbc40491c","based_on_revision":27,"task_id":"4.2","status":"complete","summary":"Реализован POST /v1/token/refresh с rotation: refresh token заменяется новым, старый отзывается, replay отзывает token family, ответ возвращает access/refresh пару. Login также выдаёт refresh token.","artifacts":[{"path":"internal/app/app.go","purpose":"Refresh endpoint и выдача refresh token при login"},{"path":"internal/repository/session.go","purpose":"Атомарная rotation и обнаружение повторного использования token"}],"verification":[{"command":"gofmt -w internal/app/app.go internal/repository/session.go","exit_code":0,"summary":"Успешно"},{"command":"GOCACHE=/tmp/iam-go-cache go test ./...","exit_code":0,"summary":"Все пакеты успешно проверены"},{"command":"GOCACHE=/tmp/iam-go-cache go vet ./...","exit_code":0,"summary":"Ошибок vet не обнаружено"}],"blockers":[],"next_action":null}