{"protocol":"execution-state.result/v1","run_id":"t25-535779e57517440e","based_on_revision":49,"task_id":"7.1","status":"complete","summary":"Реализованы встроенные и custom organization roles с фиксированными permissions для owner/admin/viewer, непустым permission set для custom roles и tenant-scoped repository. Добавлено создание custom role через HTTP API.","artifacts":[{"path":"internal/domain/role.go","purpose":"Модель ролей, permissions и валидация"},{"path":"internal/repository/role.go","purpose":"Потокобезопасный organization-scoped role repository"},{"path":"internal/app/app.go","purpose":"Wiring ролей, provision встроенных ролей и POST custom role"}],"verification":[{"command":"gofmt -w internal/domain/role.go internal/repository/role.go internal/app/app.go","exit_code":0,"summary":"Форматирование прошло."},{"command":"GOCACHE=/tmp/iam-go-cache-7-1 go test ./...","exit_code":0,"summary":"Все пакеты прошли проверку."},{"command":"GOCACHE=/tmp/iam-go-cache-7-1 go vet ./...","exit_code":0,"summary":"Статический анализ прошел."}],"blockers":[],"next_action":null}