{"protocol":"execution-state.result/v1","run_id":"t26-e85af7c30a414585","based_on_revision":51,"task_id":"7.2","status":"complete","summary":"Задача 7.2 завершена: role assignment routes защищают tenant boundary и последний owner не может потерять owner role.","artifacts":[{"path":"internal/app/app.go","purpose":"PUT/DELETE role assignment routing and last-owner protection"}],"verification":[{"command":"gofmt -w internal/app/app.go","exit_code":0,"summary":"Успешно"},{"command":"go test ./...","exit_code":0,"summary":"Успешно с изолированным GOCACHE"},{"command":"go vet ./...","exit_code":0,"summary":"Успешно с изолированным GOCACHE"}],"blockers":[],"next_action":null}