{"protocol":"execution-state.result/v1","run_id":"t29-2a4abd5d26d74dfb","based_on_revision":57,"task_id":"8.1","status":"complete","summary":"Добавлены configurable rate limiting по IP и authenticated identity, а также безопасные idempotent replay для register и invite с проверкой fingerprint запросов.","artifacts":[{"path":"internal/app/protection.go","purpose":"Rate limiter и idempotency store"},{"path":"internal/app/app.go","purpose":"Подключение ограничений и register replay"},{"path":"internal/app/organizations.go","purpose":"Invite replay"},{"path":"internal/config/config.go","purpose":"Конфигурация лимитов и TTL"}],"verification":[{"command":"gofmt -w internal/app/app.go internal/app/organizations.go internal/app/protection.go internal/config/config.go","exit_code":0,"summary":"Успешно"},{"command":"go test ./...","exit_code":0,"summary":"Все пакеты прошли"},{"command":"go vet ./...","exit_code":0,"summary":"Замечаний нет"}],"blockers":[],"next_action":null}