{"protocol":"execution-state.result/v1","run_id":"t22-aca5662427da47dc","based_on_revision":43,"task_id":"6.2","status":"complete","summary":"Реализованы POST и GET /v1/organizations с owner membership и tenant isolation через memberships пользователя.","artifacts":[{"path":"/Users/ivansosnovich/Documents/codex/skils/benchmarks/go-auth-service/results/long-runs/long-v1-gpt-5.6-luna-20260903/projects/03-sdd-skill/internal/app/app.go","purpose":"Organization dependencies, routes, creation and membership-filtered listing handlers"}],"verification":[{"command":"gofmt -w internal/app/app.go","exit_code":0,"summary":"Форматирование выполнено"},{"command":"GOCACHE=<temporary> go test ./...","exit_code":0,"summary":"Все пакеты успешно собраны"},{"command":"GOCACHE=<temporary> go vet ./...","exit_code":0,"summary":"Проверка vet завершена успешно"}],"blockers":[],"next_action":null}