{"protocol":"execution-state.result/v1","run_id":"t20-9f9f01e443b44ed3","based_on_revision":39,"task_id":"5.4","status":"complete","summary":"Добавлена защита login от перебора: normalized identity, configurable failure threshold и lock duration, конкурентный tracker и сброс счётчика после успешного login.","artifacts":[{"path":"internal/app/app.go","purpose":"Login failure tracking и временная блокировка"},{"path":"internal/config/config.go","purpose":"IAM_LOGIN_FAILURE_THRESHOLD и IAM_LOGIN_LOCK_DURATION"}],"verification":[{"command":"gofmt -w internal/config/config.go internal/app/app.go","exit_code":0,"summary":"Успешно"},{"command":"GOCACHE=/tmp go test ./...","exit_code":0,"summary":"Все пакеты успешно собраны и проверены"},{"command":"GOCACHE=/tmp go vet ./...","exit_code":0,"summary":"Замечаний vet нет"}],"blockers":[],"next_action":null}