{"protocol":"execution-state.result/v1","run_id":"t32-eb6e8a7b831c4558","based_on_revision":63,"task_id":"8.4","status":"complete","summary":"Завершено wiring приложения, server timeouts и graceful shutdown. Исправлена обработка штатного http.ErrServerClosed; все production dependencies уже связаны через app.New.","artifacts":[{"path":"cmd/iamd/main.go","purpose":"Обработка SIGINT/SIGTERM и graceful shutdown HTTP-сервера."}],"verification":[{"command":"gofmt -w cmd/iamd/main.go","exit_code":0,"summary":"Форматирование успешно."},{"command":"go test ./...","exit_code":0,"summary":"Все пакеты успешно проверены; test files отсутствуют."},{"command":"go vet ./...","exit_code":0,"summary":"Проверка vet успешно завершена."}],"blockers":[],"next_action":null}