{"protocol":"execution-state.result/v1","run_id":"t15-daf4175f7f174661","based_on_revision":29,"task_id":"4.3","status":"complete","summary":"Reuse detection реализован: повторное использование rotated refresh token отзывает всю family; последующие tokens family отклоняются.","artifacts":[{"path":"internal/repository/session.go","purpose":"Атомарный отзыв family при reuse revoked token."},{"path":"internal/app/app.go","purpose":"HTTP-обнаружение reuse и единый unauthorized response."}],"verification":[{"command":"gofmt -w internal/app/app.go internal/repository/session.go","exit_code":0,"summary":"Успешно."},{"command":"GOCACHE=/tmp/iam-task-4-3-gocache go test ./...","exit_code":0,"summary":"Все пакеты прошли."},{"command":"GOCACHE=/tmp/iam-task-4-3-gocache go vet ./...","exit_code":0,"summary":"Замечаний нет."}],"blockers":[],"next_action":null}