{"protocol":"execution-state.result/v1","run_id":"t26-d032e95d42464c15","based_on_revision":51,"task_id":"7.2","status":"complete","summary":"Реализована атомарная проверка отзыва ролей: DELETE допускает снятие owner только если в организации остаётся другой owner; tenant-scoped проверки PUT/DELETE сохранены.","artifacts":[{"path":"internal/repository/membership.go","purpose":"Добавлен атомарный RemoveRole с проверкой соответствия назначения и инварианта последнего owner."},{"path":"internal/app/organizations.go","purpose":"DELETE role assignment использует RemoveRole и корректно обрабатывает not_found/conflict."}],"verification":[{"command":"gofmt -w internal/repository/membership.go internal/app/organizations.go","exit_code":0,"summary":"Успешно."},{"command":"GOCACHE=<temporary-cache> go test ./...","exit_code":0,"summary":"Все пакеты успешно проверены."},{"command":"GOCACHE=<temporary-cache> go vet ./...","exit_code":0,"summary":"Ошибок vet нет."}],"blockers":[],"next_action":null}