{"protocol":"execution-state.result/v1","run_id":"t18-96a660098d834a06","based_on_revision":35,"task_id":"5.2","status":"complete","summary":"Реализованы password reset request/confirm: токены случайные, хранятся только как SHA-256 hash и атомарно одноразово consume-ятся; confirm меняет пароль и отзывает все refresh sessions; request не раскрывает существование email.","artifacts":[{"path":"internal/app/app.go","purpose":"HTTP endpoints password reset request и confirm"},{"path":"internal/domain/password_reset.go","purpose":"Генерация и хеширование reset tokens"},{"path":"internal/repository/password_reset.go","purpose":"Конкурентное hash-only хранилище одноразовых reset tokens"},{"path":"internal/config/config.go","purpose":"Настройка IAM_PASSWORD_RESET_TTL"}],"verification":[{"command":"gofmt -w internal/app/app.go internal/config/config.go internal/domain/password_reset.go internal/repository/password_reset.go","exit_code":0,"summary":"Форматирование выполнено."},{"command":"GOCACHE=$(mktemp -d /tmp/iam-go-cache.XXXXXX) go test ./...","exit_code":0,"summary":"Все пакеты успешно собраны и проверены."},{"command":"GOCACHE=$(mktemp -d /tmp/iam-go-cache.XXXXXX) go vet ./...","exit_code":0,"summary":"Замечаний go vet нет."}],"blockers":[],"next_action":null}