{"protocol":"execution-state.result/v1","run_id":"t23-133f6b65be3e4386","based_on_revision":45,"task_id":"6.3","status":"complete","summary":"Реализованы invite, accept и просмотр участников с opaque hashed expiring tokens, однократным atomic accept и проверкой membership в организации.","artifacts":[{"path":"internal/domain/invite.go","purpose":"Модель invite и генерация, hash и валидация opaque token."},{"path":"internal/repository/invite.go","purpose":"Потокобезопасное хранение invite только по hash и однократное потребление."},{"path":"internal/app/organizations.go","purpose":"HTTP handlers создания invite, accept invite и списка участников."},{"path":"internal/app/app.go","purpose":"Регистрация invite repository и HTTP routes."}],"verification":[{"command":"gofmt -w internal/domain/invite.go internal/repository/invite.go internal/app/organizations.go internal/app/app.go","exit_code":0,"summary":"Форматирование успешно выполнено."},{"command":"GOCACHE=<task-local-temp> go test ./...","exit_code":0,"summary":"Все пакеты успешно прошли тестирование."},{"command":"GOCACHE=<task-local-temp> go vet ./...","exit_code":0,"summary":"Проверка go vet успешно завершена."},{"command":"git diff --check","exit_code":0,"summary":"Проблем форматирования diff не обнаружено."}],"blockers":[],"next_action":null}