{"protocol":"execution-state.result/v1","run_id":"t13-d60787907c0849ce","based_on_revision":25,"task_id":"4.1","status":"complete","summary":"Реализованы opaque refresh tokens через crypto/rand, SHA-256 hashing и конкурентный session repository с user, expiry, family и revoked state.","artifacts":[{"path":"internal/domain/session.go","purpose":"Refresh token generation, hashing, and session model"},{"path":"internal/repository/session.go","purpose":"Concurrent in-memory session repository"}],"verification":[{"command":"gofmt -w internal/domain/session.go internal/repository/session.go","exit_code":0,"summary":"Форматирование успешно"},{"command":"GOCACHE=<temporary> go test ./...","exit_code":0,"summary":"Все пакеты собраны успешно"},{"command":"GOCACHE=<temporary> go vet ./...","exit_code":0,"summary":"Проверка vet успешно"}],"blockers":[],"next_action":null}