{"protocol":"execution-state.result/v1","run_id":"t16-7661c20dccfd47da","based_on_revision":31,"task_id":"4.4","status":"complete","summary":"Добавлены logout, logout-all, GET sessions и DELETE session с проверкой владельца session.","artifacts":[{"path":"internal/app/app.go","purpose":"Реализованы session management HTTP handlers и маршруты"}],"verification":[{"command":"gofmt -w internal/app/app.go","exit_code":0,"summary":"Форматирование выполнено"},{"command":"GOCACHE=$(mktemp -d /tmp/iam-gocache.XXXXXX) go test ./...","exit_code":0,"summary":"Все пакеты успешно проверены"},{"command":"GOCACHE=$(mktemp -d /tmp/iam-gocache.XXXXXX) go vet ./...","exit_code":0,"summary":"Проверка go vet успешно завершена"}],"blockers":[],"next_action":null}