{"protocol":"execution-state.result/v1","run_id":"t22-5a52e06d3b0d49b4","based_on_revision":43,"task_id":"6.2","status":"complete","summary":"Реализованы POST и GET /v1/organizations с owner membership и tenant isolation.","artifacts":[{"path":"internal/app/app.go","purpose":"Подключены repositories и маршруты."},{"path":"internal/app/organizations.go","purpose":"Реализация endpoint-ов организаций."}],"verification":[{"command":"gofmt -w internal/app/app.go internal/app/organizations.go","exit_code":0,"summary":"Успешно."},{"command":"GOCACHE=<temporary> go test ./...","exit_code":0,"summary":"Успешно."},{"command":"GOCACHE=<temporary> go vet ./...","exit_code":0,"summary":"Успешно."}],"blockers":[],"next_action":null}