{"protocol":"execution-state.result/v1","run_id":"t03-a5edca960f5246c6","based_on_revision":5,"task_id":"1.3","status":"complete","summary":"Добавлены User, PasswordMaterial, явное состояние верификации email и безопасный PublicUserProfile. Password material исключён из JSON.","artifacts":[{"path":"internal/domain/user.go","purpose":"Модели пользователя и публичного профиля"}],"verification":[{"command":"gofmt -w internal/domain/user.go","exit_code":0,"summary":"Успешно"},{"command":"GOCACHE=/private/tmp/iam-task-1-3-gocache go test ./...","exit_code":0,"summary":"Все пакеты успешно собраны и проверены"},{"command":"GOCACHE=/private/tmp/iam-task-1-3-gocache go vet ./...","exit_code":0,"summary":"Ошибок vet не найдено"}],"blockers":[],"next_action":null}