{"protocol":"execution-state.result/v1","run_id":"t24-f43dff56e5f04d46","based_on_revision":47,"task_id":"6.4","status":"complete","summary":"Реализованы PATCH/DELETE member и атомарный ownership transfer с защитой последнего owner.","artifacts":[{"path":"internal/app/app.go","purpose":"Добавлены member mutation endpoints, проверки ролей и ownership transfer"}],"verification":[{"command":"gofmt -w internal/app/app.go","exit_code":0,"summary":"Успешно"},{"command":"GOCACHE=/tmp/task-cache go test ./...","exit_code":0,"summary":"Все пакеты успешно проверены"},{"command":"GOCACHE=/tmp/task-cache go vet ./...","exit_code":0,"summary":"Ошибок vet нет"}],"blockers":[],"next_action":null}